URL,Title,Description
http://www.youtube.com/watch?v=aCxGn18su7Q,'0' b - YouTube,15 Oct 2010 - 11 sec - Uploaded by Yakkersreal ytpmv coming probably never.
http://www.youtube.com/watch?v=3GOpSXUJg2g,How to solve a quadratic equation when b=0 - Free Math Help ...,17 Dec 2010 - 3 min - Uploaded by Brian McLoganLearn how to solve quadratic equations using the square root method.  It is important to ...
http://www.youtube.com/watch?v=iz02CqXWAPs,Helppo B:0 2009 - YouTube,21 Jul 2014 - 5 min - Uploaded by RiinanaPowercup finaali 2014 62300%
http://www.youtube.com/watch?v=0_vTKekZJ2E,B.0.N.E.R PRANK ON FRIENDS (HILARIOUS) - YouTube,"7 Mar 2019 - 24 min - Uploaded by BJ GROOVYprank #prankwars #bjgroovy GROOVY GANG!! Lets Get To 1M! Make sure you  like, comment ..."
http://www.mouser.co.uk/ProductDetail/.../904-27-2-12-2-B-0?qs...,904-27-2-12-2-B-0 Wakefield-Vette | Mouser United Kingdom,"904-27-2-12-2-B-0 Wakefield-Vette Heat Sinks Chipset Heatsink with Clip, Pin 
Fin, 27mm Chip Size, 11.6mm Height, Aluminum, Black Anodized datasheet, ..."
http://www.mouser.co.uk/ProductDetail/.../910-40-1-28-2-B-0?qs...,910-40-1-28-2-B-0 Wakefield-Vette | Mouser United Kingdom,"13 Apr 2019 ... 910-40-1-28-2-B-0 Wakefield-Vette Heat Sinks Chipset Heatsink with Clip, 
Elliptical, 40mm Chip Size, 40.6mm Height, Aluminum, Black ..."
http://accounts.google.com/b/0/DisplayUnlockCaptcha,Unlock Captcha - Sign in - Google Accounts,"Not your computer? Use Guest mode to sign in privately. Learn more. Next. 
Create account.   Afrikaans  .   azərbaycan  .   català  .   Čeština  .   Dansk  .   
Deutsch  .   eesti ..."
http://www.fcbarcelona.com/en/videos/1046815/highlights-peralada-2-barca-b-0,Highlights: Peralada 2 Barça B 0 - FC Barcelona,5 Feb 2019The Catalans couldn't get a positive result in a very difficult match due to the  weather.
http://socratic.org/questions/how-do-you-solve-for-x-in-ax-b-0,How do you solve for x in ax+b=0? | Socratic,"12 Mar 2016 ... Given: ax+b=0. Subtract b from both sides. ax+b−b=0−b. ax+0=−b. ax=−b. Divide 
both sides by a giving. aa×x=−ba. But aa=1. x=−ba ..."
"http://en.wikipedia.org/wiki/(a,b,0)_class_of_distributions","(a,b,0) class of distributions - Wikipedia","In probability theory, the distribution of a discrete random variable N whose 
values are nonnegative integers is said to be a member of the (a, b, 0) class of ..."
http://en.wikipedia.org/wiki/Martin_B-10,Martin B-10 - Wikipedia,"The Martin B-10 was the first all-metal monoplane bomber to be regularly used 
by the United States Army Air Corps, entering service in June 1934. It was also ..."
http://www.lockheedmartin.com/en-us/news/features/.../b-10.html,"Air Power Wonder"": the B-10 | Lockheed Martin","""Air Power Wonder"": the B-10. When the first candidate for a new bomber for the 
U.S. Army Air Corps, a tri-motor aircraft from Henry Ford, ascended into the skies
 ..."
http://www.youtube.com/watch?v=9hJmgdT4FsY,Martin B-10 & B-12A - YouTube,23 Jun 2015 - 1 min - Uploaded by aircraftubeThe Martin B-10 was the first all-metal monoplane bomber to be regularly used by the United ...
http://www.aviation-history.com/martin/b10.html,Martin B-10 - The Aviation History Online Museum,"The Martin B-10 was the first all-metal monoplane bomber to go into regular 
service with the US Army Air Corps (USAAC). New design features included a 
fully ..."
http://science.howstuffworks.com/martin-b-10.htm,Martin B-10 | HowStuffWorks,"The Martin B-10 was a remarkable leap forward in aircraft design, both in 
materials and capabilities. The B-10 was not the bomber the U.S. would need to 
fight ..."
http://www.nationalmuseum.af.mil/Visit/Museum.../martin-b-10/,Images for b''10,"The B-10, the first ""modern"" all-metal monoplane bomber produced in quantity, 
featured such innovations as retractable landing gear, a rotating gun turret and ..."
http://www.nationalmuseum.af.mil/Visit/.../b-10-alaskan-flight/,Martin B-10 > National Museum of the US Air Force™ > Display,"In 1934 the Air Corps established a project for a mass flight to Alaska of its new 
type all-metal monoplane bomber, the Martin B-10. Such a flight would not only ..."
http://www.britannica.com/technology/B-10,B-10 Alaskan Flight > National Museum of the US Air Force ...,"B-10: military aircraft: Bombers: …overshadowed completely by the Martin B-10 
of 1932, which brought the biggest single advance in bomber design since the ..."
http://www.barco.com/en/product/b-10,B-10 | aircraft | Britannica.com,"Barco's B-10 gets you out on the road - a cost-effective solution to really be any 
time, anywhere."
http://en.wikipedia.org/wiki/Blackburn_B-20,B-10 - Barco,"The Blackburn B-20 was an experimental aircraft, first flying in 1940, that 
attempted to drastically increase the performance of flying boat designs. 
Blackburn ..."
http://en.wikipedia.org/wiki/Berezin_B-20,Blackburn B-20 - Wikipedia,"The Berezin B-20 (Березин Б-20) was a 20 mm caliber autocannon used by 
Soviet aircraft in World War II. Contents. 1 Development; 2 Specifications ..."
http://en.wikipedia.org/wiki/B20,Berezin B-20 - Wikipedia,"B20 may refer to: B20 international business summit, an international summit 
meeting of delegates from business groups around the world; B20 (biodiesel), ..."
http://mortgagepal.ca/b-20/,B20 - Wikipedia,"What the B-20 Mortgage Stress Test Means for Home Buyers [INFOGRAPHIC]. 
The Office of the Superintendent of Financial Institutions (OSFI) has been a ..."
http://www.greenclimate.fund/-/b-20-in-songdo,B-20 Stress Test: What It Means For Homebuyers [INFOGRAPHIC],"A series of online documents including GCF Board meeting agendas, decisions, 
reports, submissions, and other information such as notifications, calls for public ..."
http://www.greenclimate.fund/-/green-climate-fund-b-20-meeting-press- release,B.20 - Documents | Green Climate Fund,"4 Jul 2018 ... The 20th meeting of the GCF Board ended today in Songdo, following four days 
of challenging and difficult discussions between Board ..."
http://www.osfi-bsif.gc.ca/eng/fi-if/rg-ro/gdn-ort/gl.../b20_dft_let.aspx,Images for b''20,"17 Oct 2017 ... On July 6, 2017, OSFI published a revised draft of Guideline B-20 – Residential 
Mortgage Underwriting Practices and Procedures."
http://gcf.meta-fusion.com/b20/events,Green Climate Fund B.20 meeting press release - News | Green ...,"2 Jul 2018 ... B.20 Twentieth Meeting of the Board. 2. Adoption of the agenda and organization 
of work [part 2]. Schedule. Agenda. B.20 Agenda. Item No."
http://www.bostonbiochem.com/product/b-20,Final Revised Guideline B-20: Residential Mortgage Underwriting ...,"B-20.pdf. Pre-coupled Mg-ATP is an ideal energy source for semi-purified 
conjugation/degradation reactions. Supplied as a pH adjusted solution with no 
added ..."
http://en.wikipedia.org/wiki/Lockheed_XB-30,GCF Webcast - B.20 Twentieth Meeting of the Board - On-Demand ...,"The Lockheed XB-30 (company model L-249) was the design submitted by Lockheed after the request by the United States Army Air Forces for a very heavy bomber, the same request that led to the Boeing B-29 Superfortress, the Douglas XB-31 and Consolidated B-32 Dominator."
http://en.wikipedia.org/wiki/Bundesstraße_30,B-20 | Boston Biochem,"The Bundesstraße 30 (abbreviated B30) is a highly frequented federal highway 
in Germany running through Upper Swabia in Baden-Württemberg from Ulm to ..."
http://www.thomann.de/gb/sennheiser_d1_b_30.htm,Lockheed XB-30 - Wikipedia,"Sennheiser D1 B 30. 1 Rating. Sennheiser D1 B 30. Battery Pack for SK D1 and 
AVX1 Pocket Transmitter. For use with 2 conventional 1.5 V AA batteries ..."
http://en-uk.sennheiser.com/accessory-b-30,Bundesstraße 30 - Wikipedia,"B 30 - - - Sennheiser Discover True Sound. ... B 30. Battery compartment for use 
with mignon cells. $ 49.95. plus applicable sales tax – free shipping. Article No."
http://www.kaba-mauer.com/en/solutions/electronic.../combi-b-30.html,Sennheiser D1 B 30 – Thomann UK,"The Electronic Combination Lock Combi B 30 - with dead bolt and mechanical 
redundancy for safes CEN III-V."
http://assets.publishing.service.gov.uk/.../uploads/.../B_30i8.1.pdf,Sennheiser B 30 - - Battery pack for evolution wireless D1 SK and ...,"Investigation of Faecal Specimens for Enteric Pathogens. Bacteriology | B 30 | 
Issue no: 8.1 | Issue date: 24.04.14 | Page: 2 of 41. UK Standards for 
Microbiology ..."
http://www.fomtec.com/foam.../alpha-b-30-article63-39.html,Kaba Electronic Combination Safe Locks - Safe Lock Combi B 30,"Fomtec Alpha B -30 (also called Fomtec AB-30) is a ready to use (premixed) film 
forming foam solution for fires of class A and B. Unlike regular AFFF premixes, ..."
"http://www.mcsworld.com/master-b-30-electric-heater,388.html",B 30 - Investigation of Faecal Specimens for Enteric Pathogens,"MASTER B 30 electric heater. Power: 15,0 / 30,0 kW. 51.200 / 102.400 Btu/h. 
12.900 / 25.800 Kcal/h. Air displacement: 3.500 m³/h. Rated current: 43,5 A."
http://new.abb.com/products/ABB7TBA011960R0119,Alpha B -30 - Fomtec.com,CONDUIT NON/MET BULLET BLCK LTC025-B-30.
http://new.abb.com/products/ABB7TBD012980R0163,"MASTER B 30 electric heater. MCS - mobile heaters, cabinet ...","Light Weight Conduit, Conduit Size 25 Millimeters, Working Temperature -40 to 
105 Degrees C, 30 Meter Reel, Halogen Free Nylon 16, Black CLL025-B-30."
http://en.wikipedia.org/wiki/Boeing_B-50_Superfortress,ABB LTC025-B-30,"The Boeing B-50 Superfortress is an American strategic bomber. A post–World War II revision of the Boeing B-29 Superfortress, it was fitted with more powerful Pratt & Whitney R-4360 radial engines, stronger structure, a taller tail fin, and other improvements."
http://www.boeing.com/history/products/b-50.page,ABB CLL025-B-30,"The four-engine, propeller-powered Boeing B-50 bomber was among the last piston-powered bombers built during an era that was to be dominated by jets, particularly the B-47 and the B-52.
 ... The B-50's wing, made from the new 75ST aluminum alloy, was 16 percent stronger and 600 pounds ..."
http://www.youtube.com/watch?v=MdIWjC2yf4E,Boeing B-50 Superfortress - Wikipedia,30 Jan 2010 - 43 sec - Uploaded by jaglavaksoldierThe Boeing B-50 Superfortress was a post-World War II revision of the wartime United States B ...
http://www.youtube.com/watch?v=6dQWZz2Fr7E,Boeing: Historical Snapshot: B-50 bomber,28 Jun 2017 - 33 sec - Uploaded by NASA Armstrong Flight Research CenterThis 33-second video from the late 1950s shows the X-1 #3 being dropped from  a B-50 ...
http://fas.org/nuke/guide/usa/bomber/b-50.htm,Boeing B-50 Superfortress - YouTube,"KB-50s were B-50 bombers modified as aerial tankers, generally after they had 
become surplus to Strategic Air Command requirements. These alterations ..."
http://johnweeks.com/b50/index.html,X-1 Drop from B-50 Superfortress - YouTube,"To save the B-29D, it was redesignated B-50. Boeing and the USAAF argued that 
the B-50 was a new design airplane, so it was spared from the axe."
http://www.webmd.com/drugs/2/drug-8418/b-50...oral/details,Images for b''50,"Find patient medical information for B-50 Complex Oral on WebMD including its 
uses, side effects and safety, interactions, pictures, warnings and user ratings."
http://www.patientslikeme.com/treatment/vitamin-b-50-complex,B-50 Superfortress - United States Nuclear Forces,"Vitamin B 50 Complex: Find the most comprehensive real-world treatment 
information on Vitamin B 50 Complex at PatientsLikeMe. 21 patients with 
fibromyalgia, ..."
http://www.lambertshealthcare.co.uk/...b.../vitamin-b50-complex/,B-50 — The Superfortress Survivors - John A. Weeks III,"Our one-a-day Vitamin B-50 Complex is a high potency, comprehensive complex 
of the important B vitamin group that came out top in independent analysis."
http://en.wikipedia.org/wiki/Convair_YB-60,"B-50 Complex Oral : Uses, Side Effects, Interactions, Pictures ...","Convair B-36. The Convair YB-60 was an American prototype bomber aircraft for the United States Air Force, canceled on 14 August 1952."
http://www.youtube.com/channel/UCLKJThNsMXfridSO3vgwNvQ,Vitamin B 50 Complex: uses & side-effects | PatientsLikeMe,"Buzz60 is designed for the way we live now. Short, quirky video snacks that are a 
little sassy, and always smart. Buzz60 produces all kinds of video clips fo..."
http://www.youtube.com/watch?v=tnpvFrRel6w,Vitamin B-50 Complex | Vitamin B Complexes | Lamberts Healthcare,2 Jul 2010 - 1 min - Uploaded by Lockheed MartinFirst Flight of the YB-60 - 18 April 1952.
http://www.facebook.com/buzz60/,Convair YB-60 - Wikipedia,B/60. 26158 likes. Get a fresh perspective: today's top stories with attitude.
http://fas.org/nuke/guide/usa/bomber/b-60.htm,b/60 - YouTube,"B-60. The XB-60 was ordered by the Air Force as a precaution against some unforeseen catastrophic failure in the B-52. With a 72 percent commonality with the veteran B-36, a swept wing and tail were substituted, and eight J57 jet engines were added, resulting in a 508-mph bomber that was totally outclassed by the B-52."
http://twitter.com/buzz60?lang=en-gb,Images for b''60,"The latest Tweets from b/60 (@buzz60). Get a fresh perspective - with a little sass 
- on today's top stories. New York, NY."
http://www.air-and-space.com/YB-60.htm,YB-60 First Flight - YouTube,"Convair made 20 test flights of the YB-60 and accumulated 66 hours of flight time. 
The Air Force cancelled the B-60 production program on August 14, 1952."
http://www.bodyjunkies.co.uk/class-b-60,B/60 - Home | Facebook,"Bodyjunkies Signature B-60 Bootcamp. This fast paced class quickly switches 
between equipment and exercises tackling all the major muscle groups and ..."
http://en-us.sennheiser.com/b-60,B-60 - United States Nuclear Forces,B 60 - Microphone - - Sennheiser Discover True Sound.
http://en.wikipedia.org/wiki/North_American_XB-70_Valkyrie,b/60 (@buzz60) | Twitter,"The North American Aviation XB-70 Valkyrie was the prototype version of the planned B-70 nuclear-armed, deep-penetration strategic bomber for the United States Air Force Strategic Air Command."
http://nationalinterest.org/.../xb-70-valkyrie-why-didnt-america-build-mach- 3-monster-bomber-19113,YB-60 page - Air-and-Space.com,"19 Jan 2017 ... The nail in the coffin was the jet's exorbitant price tag and lack of mission 
flexibility—the B-70 couldn't be adapted for the low level role."
http://fas.org/nuke/guide/usa/bomber/b-70.htm,Bodyjunkies B-60 Bootcamp,"B-70 Valkyrie. With research and development studies beginning in 1955, the XB-70 was a large, long-range strategic bomber was planned to be the replacement for the B-52."
http://www.youtube.com/watch?v=oHqNNOiooLQ,Sennheiser B 60 - Microphone,"29 Apr 2017 - 11 min - Uploaded by Curious DroidThat's not a plane, it's a 3 plane formation” that's what General Curtis LeMay said  of the plans ..."
http://www.youtube.com/watch?v=fCORwUxlNQo,North American XB-70 Valkyrie - Wikipedia,"5 Feb 2011 - 3 min - Uploaded by murphytimehttp://newyork.craigslist.org/mnh/tlg/5757644303.html On 8 June 1966, XB-70A # 2 was in close ..."
http://www.youtube.com/watch?v=doYEIVapNtA,XB-70 Valkyrie: Why Didn't America Build This Mach 3 Monster ...,"12 Sep 2014 - 6 min - Uploaded by ArmedForcesUpdateThe North American Aviation XB-70 Valkyrie was the prototype of the B-70  nuclear-armed, deep ..."
http://www.nationalmuseum.af.mil/.../north-american-xb-70-valkyrie/,B-70 Valkyrie - United States Nuclear Forces,"Less costly, nuclear-armed ICBMs (Intercontinental Ballistic Missiles) were also 
entering service. As a result, in 1961, the expensive B-70 bomber program was ..."
http://www.nasa.gov/centers/armstrong/news/.../FS-084-DFRC.html,XB-70 Valkyrie - The Worlds Fastest Bomber - YouTube,"28 Feb 2014 ... The B-70 Valkyrie, with a planned cruise speed of Mach 3 and operating altitude 
of 70000 feet, was to be the ultimate high-altitude, high-speed ..."
http://www.boeing.com/history/products/xb-70-valkyrie.page,"XB-70 Valkyrie Mid-air collision June 8, 1966 - YouTube","On April 10, 1961, the Air Force cut back the B-70 to a research program, and 
only two of the aircraft would be built. A second Valkyrie, the XB-70A-2, flew on ..."
http://www.youtube.com/watch?v=rvr8xgV9NoA,WORLDS FASTEST BOMBER Aircraft us air force XB 70 Valkyrie ...,20 Apr 2015 - 6 min - Uploaded by David MontgomeryThis is a Browning B-80 made in 1986 in Portugal.  It is a gas operated semi automatic 12 gauge ...
http://www.browning.com/support/.../b-80-automatic-shotgun.html,North American XB-70 Valkyrie > National Museum of the US Air ...,"Date, Historic Information, Serial Number Info. 1981-1988, In 1976 Browning re-
standardized its serial number identification. The B-80 went out of production in ..."
http://www.kaercher.com/my/.../b-80-w-bp-22590010.html,NASA Armstrong Fact Sheet: XB-70 Valkyrie | NASA,"The B 80 W Bp battery-powered walk-behind scrubber drier with traction drive 
can be optionally equipped with roller brush head with contra-rotating roller ..."
http://www.kaercher.com/uk/.../b-80-w-1259010206.html,Boeing: Historical Snapshot: XB-70A Valkyrie,"B 80 W Bp scrubber dryer for diverse battery types (24 V, 170-240 Ah). With roller 
brush system (including pre-sweep function for coarse particles), fully ..."
http://www.mouser.co.uk/ProductDetail/Visaton/B-80-8-Ohm?qs...,Images for b''70,"B 80 - 8 Ohm Visaton Speakers & Transducers 8 cm (3.3) full- range loudspeaker 
datasheet, inventory & pricing."
http://www.offshoreenergytoday.com/indias-hoec-hands-in-development- plan-for-b-80-field/,Images for b''80,"14 Nov 2017 ... India's Hindustan Oil Exploration Company (HOEC) has submitted its field 
development plan (FDP) for offshore block B-80 to the country's ..."
http://www.amazon.co.uk/Novus-80-Staple.../dp/B000OY89P0,Browning B-80 in 12 Gauge - YouTube,"Package Quantity: 1. Size: NOVUS B 80. Weight is approximately 33g. Small and 
handy; It is able to remove all sized staples."
http://store.humanware.com/heu/brailliant-b-80-new-generation.html,B-80 Automatic Shotgun - Browning,"Image of a Brailliant B 80 (NEW generation); Image of a young man using the 
Brailliant B 80 to read on his computer; Image of the Brailliant B thumbkeys; 
Image ..."
http://www.pumpsukltd.com/dab-evoplus-b-80-250-40-m-circulator.html,Scrubber drier B 80 W Bp | Kärcher,"The Evoplus B 80/250.40 M electronic circulator from DAB can be used in 
heating, ventilation, and air conditioning systems for residential and commercial ..."
http://www.kaercher.com/uk/.../b-90-r-classic-11613070.html,Scrubber Dryer B 80 W | Kärcher UK,"The B 90 R range provides simple, highly productive scrubbing and drying in a 
compact ride-on package. The B 90 R features Kärcher's interchangeable brush
 ..."
http://www.kaercher.com/.../b-90-r-classic-bp-11613060.html,B 80 - 8 Ohm Visaton | Mouser United Kingdom,"The B 90 R Classic Bp battery-powered ride-on scrubber dryer is compact, versatile, features an extended tank capacity and variable working widths (55, 65, 75 cm).
 ... The B 90 R Classic Bp ride-on scrubber dryer features the new brush head generation.
 Roller and disc brush heads can ..."
http://www.kaercher.com/.../b-90-r-configured-11610002.html,India's HOEC hands in development plan for B-80 field | Offshore ...,"B 90 R configured. Battery-powered ride-on scrubber dryer. With its compact 
construction, high flexibility and enlarged tank volume it is an agile alternative to
 ..."
http://www.youtube.com/watch?v=ya329RJLi4U,Novus B 80 Staple Remover - Black: Amazon.co.uk: Office Products,"1 Apr 2010 - 4 min - Uploaded by MasonTechnology1Since 1979, Büchi Labortechnik AG has been supplying the Mini Spray Dryer B- 190, B-191 and ..."
http://www.buchi.com/gb-en/.../spray.../nano-spray-dryer-b-90-hp,Humanware - Brailliant B 80 (NEW generation) - Blindness ...,"Gently processing of the smallest sample amounts into submicron particles with 
little loss are the key features characterizing the Nano Spray Dryer B-90 HP."
http://s1.kaercher-media.com/.../en.../1.161-310.0_PI_en_INT.pdf,DAB Evoplus B 80/250.40 M Circulator - Pumps UK LTD,"B 90 R Adv Dose Bp. Battery-powered ride-on scrubber dryer as successor of BR 
/ BD Trike. With its compact con- struction, high flexibility and enlarged tank ..."
http://www.hiremech.co.uk/wp-content/uploads/B-90-R.pdf,Scrubber dryer B 90 R Classic | Kärcher UK,"The B 90 R range from Kärcher brings a new level of flexibility and value to 
scrubber driers. As well as several improvements over the BR and BD Trike ..."
http://en.wikipedia.org/wiki/Aeromarine_B-90,B 90 R Classic Bp | Kärcher International,"The Aeromarine B-90 is an aircraft engine built by the Aeromarine Plane and 
Motor Company in 1915. Aeromarine made two series of V-8 engines. The B 
series ..."
http://www.pwssouthwales.co.uk/b-90-r-adv.html,B 90 R configured | Kärcher International,"Compact, high productivity ride-on scrubber drier with advanced features."
